<?xml version="1.0" encoding="UTF-8"?>
<!--
Click nbfs://nbhost/SystemFileSystem/Templates/Licenses/license-default.txt to change this license
Click nbfs://nbhost/SystemFileSystem/Templates/XML/XMLDocument.xml to edit this template
-->


<sales  xmlns = "http://europeandynamics.com/sales"  
        xmlns:xsi = "http://www.w3.org/2001/XMLSchema-instance"
        xsi:schemaLocation="http://europeandynamics.com/sales  sales.xsd">
    <order>
    <customer>
        <name>Nik Nik</name>
        <address>Athens</address>
    </customer>
    <products>
        <product quantity="2">
        <id>1</id>
        <name>chips</name>
        <price>1.20</price>
     </product>
        <product quantity="1">
        <id>12</id>
        <name>choco</name>
        <price>1.40</price>
     </product>
        <product quantity="3">
        <id>15</id>
       <price>1.50</price> <name>chiklet</name>
        
     </product>
    </products>  
    <payment></payment>
   </order> 
</sales>
